,date,description,link
0,5/14/2016,"Ho-gene Choe, Steven Wilson, and Konstantinos Pappas present work at Midwest Speech and Language Days and Midwest Computational Linguistics Colloquium 2016",http://linguistlist.org/msld2016/
1,4/26/2016,Girls Encoded motivates students to study CS,http://www.eecs.umich.edu/eecs/about/articles/2016/Girls-Encoded.html
2,3/21/2016,Ho-gene Choe and Steven Wilson present work at AAAI Spring Symposium 2016,http://www.aaai.org/Symposia/Spring/sss16.php
3,2/12/2016,"""What’s Hot in Human Language Technology:
Highlights from NAACL HLT 2015” published in AAAI 2016",http://www.aaai.org/ocs/index.php/AAAI/AAAI16/paper/download/12552/12277
4,11/4/2015,Lie-detecting algorithm spots fibbing faces better than humans,https://www.newscientist.com/article/mg22830462-700-lie-detecting-algorithm-spots-fibbing-faces-better-than-humans/
,,,